{
  "corpusId": "tatoeba-fr-2026-06-06",
  "documents": [
    {
      "artifactId": "artifact:textpack-fr-corpus:full:tatoeba-fra-sentences-detailed:2026-06-06",
      "checksum": "sha256:bc6a17bd87705dc021a1cc2fd2cddc7b6862cd60b0128ea5dda2dbb50910cfd1",
      "documentId": "tatoeba-fra-sentences-detailed-2026-06-06",
      "languageTag": "fr",
      "metadata": {
        "artifactDescriptor": {
          "artifactId": "artifact:textpack-fr-corpus:full:tatoeba-fra-sentences-detailed:2026-06-06",
          "cacheKey": "tatoeba-fra-sentences-detailed-tsv-bz2-2026-06-06",
          "checksum": {
            "algorithm": "sha256",
            "value": "bc6a17bd87705dc021a1cc2fd2cddc7b6862cd60b0128ea5dda2dbb50910cfd1"
          },
          "compression": "bzip2",
          "expectedFiles": [
            {
              "checksum": "sha256:bc6a17bd87705dc021a1cc2fd2cddc7b6862cd60b0128ea5dda2dbb50910cfd1",
              "path": "fra_sentences_detailed.tsv.bz2",
              "sizeBytes": 14624789
            }
          ],
          "licenseExpression": "CC-BY-2.0-FR",
          "mediaType": "text/tab-separated-values",
          "profile": "full",
          "redistributionPolicy": "redistributable-with-attribution",
          "retrieval": {
            "instructions": "Fetch explicitly from Tatoeba weekly exports and verify the SHA-256 checksum before unpacking or indexing.",
            "kind": "https",
            "uri": "https://downloads.tatoeba.org/exports/per_language/fra/fra_sentences_detailed.tsv.bz2"
          },
          "sizeBytes": 14624789,
          "sourceIds": [
            "source:tatoeba:weekly-french-2026-06-06"
          ],
          "version": "2026-06-06"
        },
        "etag": "\"6a23bdb9-df2815\"",
        "lastModified": "Sat, 06 Jun 2026 06:27:05 GMT",
        "licenseExpression": "CC-BY-2.0-FR",
        "rowCount": 718596,
        "sourceId": "source:tatoeba:weekly-french-2026-06-06",
        "tatoebaLanguageCode": "fra"
      },
      "path": "fra_sentences_detailed.tsv.bz2",
      "script": "Latn",
      "split": "full",
      "title": "Tatoeba French detailed sentences weekly export 2026-06-06"
    }
  ],
  "kind": "corpus",
  "languageTags": [
    "fr"
  ],
  "schemaVersion": "1",
  "splits": [
    "full"
  ]
}
