{
  "corpusId": "tatoeba-en-2026-06-06",
  "documents": [
    {
      "artifactId": "artifact:textpack-en-corpus:full:tatoeba-eng-sentences-detailed:2026-06-06",
      "checksum": "sha256:401a4ff01d6749cb44fc2eccad4f2699ebe775096b5cba7441e00f0a76c91579",
      "documentId": "tatoeba-eng-sentences-detailed-2026-06-06",
      "languageTag": "en",
      "metadata": {
        "artifactDescriptor": {
          "artifactId": "artifact:textpack-en-corpus:full:tatoeba-eng-sentences-detailed:2026-06-06",
          "cacheKey": "tatoeba-eng-sentences-detailed-tsv-bz2-2026-06-06",
          "checksum": {
            "algorithm": "sha256",
            "value": "401a4ff01d6749cb44fc2eccad4f2699ebe775096b5cba7441e00f0a76c91579"
          },
          "compression": "bzip2",
          "expectedFiles": [
            {
              "checksum": "sha256:401a4ff01d6749cb44fc2eccad4f2699ebe775096b5cba7441e00f0a76c91579",
              "path": "eng_sentences_detailed.tsv.bz2",
              "sizeBytes": 34699431
            }
          ],
          "licenseExpression": "CC-BY-2.0-FR",
          "mediaType": "text/tab-separated-values",
          "profile": "full",
          "redistributionPolicy": "redistributable-with-attribution",
          "retrieval": {
            "instructions": "Fetch explicitly from Tatoeba weekly exports and verify the SHA-256 checksum before unpacking or indexing.",
            "kind": "https",
            "uri": "https://downloads.tatoeba.org/exports/per_language/eng/eng_sentences_detailed.tsv.bz2"
          },
          "sizeBytes": 34699431,
          "sourceIds": [
            "source:tatoeba:weekly-2026-06-06"
          ],
          "version": "2026-06-06"
        },
        "etag": "\"6a23bdb9-21178a7\"",
        "lastModified": "Sat, 06 Jun 2026 06:27:05 GMT",
        "licenseExpression": "CC-BY-2.0-FR",
        "rowCount": 2028855,
        "sourceId": "source:tatoeba:weekly-2026-06-06",
        "tatoebaLanguageCode": "eng"
      },
      "path": "eng_sentences_detailed.tsv.bz2",
      "script": "Latn",
      "split": "full",
      "title": "Tatoeba English detailed sentences weekly export 2026-06-06"
    }
  ],
  "kind": "corpus",
  "languageTags": [
    "en"
  ],
  "schemaVersion": "1",
  "splits": [
    "full"
  ]
}
